題目,答案
依「公司法」第167條第2項規定，收回或收買之股份，公司應於幾個月內按市價出售，逾期未出售者，視為公司未發行股份並變更登記？,6個月
經評估客戶單日買賣額度達新台幣多少金額以上者，其徵信資料應視客戶資產狀況隨時調查更新？,500萬元
有關ETN交易限制事項，下列何者為非？,不得零股交易
某手機大廠推出新產品有重大瑕疵，影響該公司股價下跌，請問這屬於何種風險？,事業風險
下列何者為約當現金：,三個月期定期存款
將一項利息收入誤列為營業收入，將使當期淨利：,不變
結構化與非結構化資料分析與處理屬於下列哪一項金融科技與證券業的未來發展？,數據分析
證券商向違約投資人收取違約金，下列何者正確?,當沖交易得以買賣沖銷後差價金額為收取違約金上限
已依證交法發行之公司，其募集與發行公司債之規定，何者敘述為非？,僅能發行有擔保公司債、轉換公司債或附認股權公司債
審查發行人所申報之財務報告資料時，發現不符合法令規定，得以命令糾正、限期改善並處罰該發行人之機關為：,金管會
證券暨期貨市場各服務事業應針對不同規模設置資訊安全專責單位及主管，其資本額達多少以上者應設資安專責單位，該單位應配置專責主管及至少三名專責人員?,200億以上
「證券交易法」所訂公開說明書之編製義務人為何？,發行人
證券仲裁事件，爭議當事人間對仲裁人不能依協議推定另一仲裁人時，應由何一方式決定？,由仲裁協會指定
上市有價證券私人間之直接讓受，其數量不得超過該證券之多少個成交單位？,1個
"三民公司購買設備，成本1,000,000，估計可用10年，殘值50,000。若採用雙倍餘額遞減法（Double Declining Balance）提列折舊，則使用第2年之折舊費用若干？",160000
下列有關櫃檯買賣交易原則之敘述，何者有誤？,櫃檯買賣證券商以等殖成交系統為櫃檯買賣時，其申報買賣數量須一次成交，不得部分成交
證券商交割專戶設置客戶分戶帳相關之報表、憑證及文件應至少保存多久?,五年
下列有關資本結構比率之公式，何者正確？,負債比率＝負債總額／資產總額
"甲公司X7年1月1日帳列長期投資－乙公司已上市普通股50%股權(取得成本與股權淨值間無差異)，X7年乙公司淨利為200,000，甲公司並獲配其發放現金股利20,000，則甲公司該年度可認列投資收益：",100000
不動產、廠房及設備不以淨變現價值為評價依據，係基於：,繼續經營之假設
下列何者非信用交易之功能?,鼓勵投機獲利
下降楔形（Falling Wedge）通常被視為連續型態（Continuation Pattern），但有時也可能成為：,底部反轉型態
發行人要將其股票在交易所掛牌買賣，交易所因提供場所，每年依據發行有價證券之總面值，向發行人收取之費用稱為?,上市費
下列何者並非在臺灣證券交易所(集中交易市場)上市買賣的有價證券？,股票選擇權
下列何者為金管會推動金融科技的目標？,其他3個選項皆是
甲上市公司8月份的營收為6億元。依證券交易法之規定，該公司8月份月營收報表最晚應在何時以前申報？,2025-09-10 00:00:00
標借證券之最高標借單價，以融券差額發生日該種證券收盤價格多少為限？,0.07
公司制證券交易所之最低實收資本額為：,新臺幣5億元
下列何者非公司重整時，關係人會議之任務？,選派重整人
下列何者非屬「上市上櫃公司永續報告書確信機構管理要點」中永續指標或溫室氣體之確信標準?,TWSAE3401A
下列何者是測驗一企業短期償債能力之最佳比率？,速動比率
所謂總體經濟分析，不包括下列哪項？,公司接單情形
某證券商淨值為一億元，自辦融資融券對某一證券融資總金額不得超過多少？,一千萬元
下列有幾項財務分析有助於評估企業的資產結構？　甲、負債對權益比率；乙、總資產報酬率；丙、不動產、廠房及設備對權益比率；丁、利息保障倍數,1項
關於逐筆交易實施後，新增的委託種類，下列何者有誤？,委託價格及種類上，增加「全權委託」
證券商從事櫃檯買賣業務，下列何者非必要條件？,增加二千萬元之提撥資本
轉換公司債持有人請求轉換，公司或其代理人於受理轉換之請求後，應於幾個營業日內發給債券換股權利證書？,5個營業日
下列哪些措施無法強化資訊揭露，提升上市公司的資訊透明度？,避免召開法說會
下列何者不是比較財務報表分析的限制？,前後兩期更換管理階層
市場投資組合的預期報酬率為18%，無風險利率為4%，則風險溢酬為：,0.14
申請股票上櫃公司須指定幾家主辦推薦證券商，方得申請其股票登錄為櫃檯買賣？,二家
在其他條件相同之下，一年發放一次孳息的甲債券與半年發放一次孳息的乙債券，何者面臨之風險較大？,甲
有價證券在集中市場之買賣，原則採下列何者交割方式﹖,現款現貨
下列何者非財務報告分析時之限制？,無法做量化的分析
現行我國公司發給之員工紅利於財務報表中係列為：,營業成本或費用
可贖回公司債之贖回權利是操之於：,發行公司
甲為Z上市公司董事長，其於某年1月10日以每股10元買進Z公司股票一萬股，又於同年3月15日以每股18元賣出Z公司股票一萬股。甲之行為應負證券交易法上何種責任？,短線交易
下列何者為對公開發行公司無義務申報持股變動之人？,檢查人
初次申請股票上市之發行公司，其有價證券上市契約生效後，在下列何項期限內未完成公開銷售者，證券交易所得註銷該上市案：,三個月
公司召開實體股東會，並以視訊加以輔助，股東會議事手冊應納入哪項資訊？,其他3個選項皆是
下列關於公司治理評鑑結果公布之描述，何者「不」正確?,未有以產業及市值之分組方式公布
影響債券違約風險的描述，何者為真?,信用評等愈高，違約風險愈小
上市公司自願公開每月自結損益資訊者，應於當月結束後多久前申報?,次月底
對公開說明書之重要內容記載，能證明已經合理調查，並有正當理由確認其簽證或意見為真實者，而不負賠償責任者，係下列何人？,專門職業或技術人員
下列哪些規則或契約是證券交易所依法應訂立者？,其他3個選項皆是
下列何者非為買賣委託書上之委託方式?,電報委託
財務比率分析並未分析下列公司何項財務特質？,購買力風險
事業風險之於營運槓桿，如同財務風險之於：,財務槓桿
若一投資組合的貝它（β）係數小於0，則其與市場投資組合的相關係數為：,小於0
下列何種資產之流動性最低？,商譽
上市公司的年度財務報告應於每會計年度終了後多久期限內內公告申報?,3個月
哪些分析工具可從半強式效率市場中賺取超額的報酬？,內線消息
投資人開立買賣上市有價證券帳戶時，證券經紀商應依何種順序編列開戶帳號？,開戶順序
證券交易所有違反法令之行為時，主管機關得為解散證券交易所之處分，但應先報經何一機關核准？,行政院
不限用途款項借貸之融通期間屆期得展延2次，惟最初融通期間以多久為限?,6個月
「證券交易法」所稱發行人，指募集及發行有價證券之公司，或募集有價證券之何人？,發起人
何者是行情走疲的訊號？,M頭
公開發行公司編製財務預測所表達的項目，可以不包括下列那一項？,利息費用
證券交易法規定，涉及違反內線交易之罪者，可能應負：,其他3個選項皆有可能
以下有關附條件交易的敘述，何者「不正確」?,公司債附買回交易的利率會低於公債附賣回的利率
公開發行股票公司之內部人未依規定於每月五日向所屬公開發行公司申報上個月份持股變動情形者，主管機關可處？,新臺幣二十四萬元以上，四百八十萬元以下罰鍰
下列何者非為iXBRL之申報內容範圍？,會計師工作底稿
上市公司訂定「印鑑使用之管理」之內部控制制度，下列敘述何者為是？,其他3個選項皆是
買賣股票不可透過哪種方式委託下單買賣股票？,通訊軟體(例如Line)
證券承銷商於承銷期間為自己取得代銷之上市股票者，其法定最高罰鍰，為下列何項？,相當於取得有價證券之金額
"鎮安公司X2年度其銷貨收入90,000元，銷貨成本為60,000元，則鎮安公司的銷貨毛利率為何？",0.33
公司月營收應於次月幾日前公告並申報?,10日
透過櫃買中心「黃金現貨交易平台」買賣黃金現貨漲跌幅度的限制為：,沒有漲跌幅的限制
申請以科技事業上市之發行公司，其實收資本額至少應達新臺幣多少以上？,三億元
阿呆看到報紙報導某國外知名科技公司外國公司想要來台發行股票，請問如果要以科技事業申請來臺第一上市，則下列選項何者為非?,有3年以上業務紀錄
下列何者不屬於短期償債能力的指標？,負債比率
資本資產訂價模型（CAPM）認為貝它（β）係數為1之證券的預期報酬率應為：,市場報酬率
公開發行公司發放股票股利，原則上應事前經下列何者之同意通過？,股東會之特別決議
依據證券交易法規定，證券承銷方式不包含下列哪一種型態？,居間銷售
自然人在盤中零股交易之下單方式為何?,僅限電子式下單
逐筆交易後，只有以下何種委託方式，可能會觸發瞬間價格穩定措施？,限價ROD
下列有關總資產報酬率之敘述，何者不正確？,分子為淨利加利息費用
外國證券商在中華民國設置分支機構，依規定不須具備之條件為：,在東京、倫敦、紐約任一交易所是會員
櫃檯買賣股票之發行人應於每月幾日以前，於證券櫃買中心指定之網際網路資訊申報系統申報上月份營運情形？,10日
為何ETF的管理費較一般共同基金低廉？,因為ETF根據指數成分股建構投資組合，不需支付個股研究分析費用
股份有限公司業務之執行，由何機關決定之？,董事會
發行人募集與發行有價證券，自申報生效通知到達之日起，逾一定時日尚未募足並收足現金款項者，金融監督管理委員會得撤銷或廢止其申報生效。其一定時日是指：,三個月
興櫃一般板股票交易漲跌幅度的限制為：,沒有漲跌幅的限制
下列何者非證券交易所對違反證券交易所相關業務規則者之經紀商所為之處分？,廢止證券商登記
股份有限公司發行新股時，除有特別規定者外，應保留原發行新股總額百分之多少股份由公司員工承購？,百分之十至百分之十五
證券金融公司應向委託人收取融資利息依下列哪一種方式計收？,融資成交日後第二營業日迄清償日前一日之日數計算
下列簡稱何者非為創新板上市公司？,創創
我國全體上市櫃公司（含合併財務報告子公司）最晚須在何時揭露溫室氣體盤查之減碳目標？,2027年
證券經紀商對客戶折讓之手續費，應如何給付？,撥入至原交割帳戶
下列敘述何者最能解釋資本市場線（CML）？,資本市場線是效率投資組合的訂價模式
潮州公司的股價為40元，每股股利為4元，則其股利收益率為：,0.1
股份有限公司之少數股東在具備以下何項資格時，得以書面記明提議事項及理由，請求董事會召集股東臨時會?,繼續一年以上，持有已發行股份總數3%以上股份
依公司法規定，股份有限公司之股東得自行召集股東臨時會之條件為何？,繼續持有三個月以上，持有已發行股數總數過50%
關於「券商對媒體轉載之說明」，不需包含下列何者事項?,如媒體非經同意而引述，券商所採取之行動
假設目前甲公司的淨值為900萬元，流通在外股數為100萬股，若所屬產業的合理市價淨值比為11倍，則其合理股價應為：,99元
當事人之一方已選定仲裁人之後，得以書面方式催告另一方於多久內選定仲裁人？,14日
公司決定提高股利支付率，將使未來年度本益比：,無法判斷
「證券交易法」第一百五十七條之一所定內部人交易之民事賠償責任，其賠償對象為下列何者？,當日就該股票善意從事相反買賣之人
下列何者非證券自營商於營業處所議價買賣股票之範圍？,零股買賣
公司召開股東會時，股東行使其表決權，下列敘述何者為非？,得以公告方式行使其表決權
股票發行之溢價應列入：,資本公積
委託人未依規定交付融資自備款或融券保證金者，證券商之下列處理方式何者正確？,代辦交割手續
證券商代理證券金融公司辦理融資融券買賣業務，應編製何種報表與證券金融公司辦理對帳？,證券金融事業融資融券申請表
投資人對於媒體轉載證券商研究報告，何者錯誤?,媒體轉載個股價格，可直接參考，無須注意分析內容
逐筆交易實施後，何種委託種類會觸發並進入價格穩定措施？,一般限價委託
上市公司應設置薪資報酬委員會，有關薪資報酬委員會成員應取得之專業資格條件不包含？,AI
根據資本資產訂價模型（CAPM），抗跌性強的股票其系統性風險指標可能為：,β＜1
證券商得為認購（售）權證發行人資格條件為：,經營自營、承銷及經紀業務之綜合證券商
下列何者非「證券交易法」規範事項？,公司之設立登記與組織
經中央目的事業主管機關出具其係屬科技事業或文化創意事業且其產品開發成功具有市場性之明確意見書之公司，申請上櫃時得不受哪一申請條件限制？,設立滿二個完整會計年度
下列何種人員不得進入集中交易市場？,證券商業同業公會派駐人員
下列何種科目不在資產負債表中？,所得稅費用
何者不屬於市場風險？,某公司被同業併購
公開發行股票公司之何種人員轉讓股票，應按「證券交易法」之特別規定為之？,持股超過公司股份總額百分之十之股東
不動產抵押債權證券屬於：,金融資產
股票已上市公司，再發行新股者，其新股股票於何時起上市買賣？,新股股票向股東交付之日
有關董事會評鑑之評估方式有哪些？,其他3個選項皆是
股票已在經核定之國外證券市場掛牌交易，且經財團法人中華民國證券櫃檯買賣中心同意上櫃買賣者稱之為？,第二上櫃公司
於櫃檯買賣之公司債之最低成交單位為面額：,一萬元
證券商欲經營外國債券之經紀或自營買賣業務，須先取得哪一機關許可?,中央銀行
下列何者為窗飾之作法？,其他3個選項皆是
法定盈餘公積之性質屬於：,保留盈餘之一部分
轉換公司債每一交易單位之面額為多少？,新臺幣十萬元
下列何者在計算時，會將有關的資產轉換成現金所需時間的長短列入考量？,流動性指數
何者金融創新應用可以快速回應事件的發生？,市場供應
下列何者須於送件7個營業日前委託股務代理機構，透過網際網路資訊申報系統向集保公司申請專業股務代理機構證明文件？,其他3個選項皆是
申請創新板上市時，何者非為強制集保之對象？,財務長
臺灣證券交易所對在計算發布處置基數期間，未曾依監視當沖標準公布注意交易資訊之有價證券，處置措施的期間為何？,10個營業日
證券商交割專戶設置客戶分戶帳應逐日編製日報表，並於每日何時傳送前日日報表資料予證券交易所，再由證券交易所轉傳集保結算所提供客戶查詢?,10:00:00
有關國內採用IFRSs預計產生之效益，下列何者錯誤？,財務報表的揭露規定較為簡化，可大幅減少成本
有一投資組合由甲、乙兩股票組成，請問在什麼情況之下，投資組合報酬率之標準差為甲、乙兩股票個別標準差之加權平均？,兩股票報酬率相關係數＝1
下列何者非證券集中保管事業之經營業務？,代辦證券商之融資融券事項
假設履約價格為八十元，標的股票價格為七十元，則該認購權證處於：,價外（Out-of-the-money）
應付員工之退休金負債，應如何計提？,按權責基礎
當投資人的風險態度轉趨保守時，證券市場線（SML）將會：,斜率變陡
對於上市之有價證券，意圖影響集中交易市場有價證券交易價格，而散布流言或不實資料者，最高可處幾年有期徒刑？,10年
以下有關買賣委託之敘述，何者錯誤?,限價買進時，不得在限價以下成交
某證券商流動資產為二十億元，則其流動負債不得超過多少元？,20億元
下列敘述何者正確？,資訊資產應列有清冊，清冊並應加以維護
開立受託買賣帳戶滿幾個月才可申請開立信用帳戶？,三個月
一般而言，若公司未來成長機會的價值已被反映到當期股價上，則購買何種股票的投資人將無法賺到超額報酬？甲.負成長公司；乙.零成長公司；丙.正成長公司,甲、乙、丙
從事房地產銷售之A上市公司（下稱A公司）擬辦理私募普通股，甲、乙、丙、丁皆為合格應募人。依我國現行證券法令及相關實務見解，A公司對何人於私募完成前負有提供與本次私募有關財務、業務或其他資訊之義務。？,淨資產超過新臺幣1千萬元、以股市、房地產投資為專業之自然人丙
哪一個機構是資本市場促進資本形成之主要成員？,證券商
申請創新板上市應先由主辦證券承銷商上市輔導或登錄為興櫃股票櫃檯買賣，期限規定為何？,6個月
下列何者非景氣同時指標（Coincident indicator）？,股價指數
根據馬凱爾五大定理，一債券到期殖利率上升一碼與下降一碼所產生之折價額與溢價額比較為何?,折價額小於溢價額
下列何者非為買賣委託書上之委託方式?,網際網路委託
某上市公司正依破產保護法之規定進行相關程序，公司董事實際知悉後，在消息發布前即賣出該公司股票，可能涉有？,內線交易
"甲公司應收帳款週轉率13，當年度平均應收帳款$50,000，平均不動產、廠房及設備餘額$500,000，則不動產、廠房及設備週轉率為：",1.3
證券商之董事、監察人、大股東及從業人員買賣上櫃股票應如何辦理？,應於本身所投資或服務證券商買賣
櫃檯買賣市場上受託買賣之手續費率係?,由證券櫃買中心報請金管會核定之
失業率是景氣循環的：,落後指標
下列有關「公司法」所稱「關係企業」之敘述何者正確？,關係企業包括控制與從屬公司以及相互投資公司
經評估客戶單日買賣額度在多少金額以上者，其徵信資料應視客戶資產狀況隨時調查更新？,500萬元
因融券而標借、標購所產生之費用，由何人負擔？,融券人
從短期債權人的角度來看，下列何者最沒有意義？,應收帳款週轉率
推薦證券商自其所推薦之股票開始在櫃檯買賣之日起多久期限內，不得辭任？,一年
下列何者之交易方式不屬於與推薦證券商或造市商議價交易？,上櫃股票
武塔公司本年度存貨週轉率比上期增加許多，可能的原因為：,其他3個選項都是可能的原因
證券商經營櫃檯買賣，應遵守下列哪一事項？,兼具證券自營商及證券經紀商者，應於每次買賣時之書面文件，區別其為自行或代客買賣
臺灣創新板漲跌幅限制為：,0.1
下列股東會實務，何者並「不」符合公司治理原則？,阻止小股東發言
證券商辦理有價證券買賣融資融券，對所留存客戶融券賣出價款及融券保證金，不得作下列哪項運用？,有價證券之自營買賣
"三民公司購買設備，成本$1,000,000，估計可用10年，殘值$50,000。若採用雙倍餘額遞減法（Double Declining Balance）提列折舊，則使用第2年之折舊費用若干？",160000
證券集中交易市場買賣成交之有價證券，其集中交割之收付作業係由交易所委託下列何機構辦理？,證券集中保管事業
當市場報酬率變動4%時，若甲股票報酬率也隨之變動6%，請問甲股票的貝它係數為何？,1.5
根據資本資產訂價模型（CAPM），若一證券之期望報酬率低於無風險利率，則：,貝它係數為負
合約負債中，滿足履約義務的部分應轉入下列那一個帳戶？,收入
依「公司法」規定，解散之公司，在清算時期中，得於何種目的範圍，暫時經營業務？,得為了結現務及便利清算之目的，暫時經營業務
衡量一個企業來自營業活動現金流量是否足以支應資本支出，存貨淨增加數及現金股利需求的比率稱為：,現金流量允當比率
下列交易行為何者為證券商或其分支機構所禁止？,其他3個選項皆是
生物辨識技術目前廣為金融或科技業者使用，下列何者不是目前常用的生物特徵？,DNA
證券商得經客戶指示，以證券商交割專戶辦理下列何種業務款項之收付?,其他3個選項皆是
投資人首次買賣下列ETF前，那個不須先簽署風險預告書？,全球5G股票ETF
自113年第幾季起，發送通過財務報表的董事會召集通知應發布重訊?,第1季
竹田公司的淨利率為0.02，權益報酬率為10%，平均資產總額／平均權益比為2，則其總資產週轉率為：,2.5
雲林公司出售以持有供交易為目的之投資所產生之現金流量，屬於：,營業活動
以下何種投資人可以使用綜合交易帳戶進行買賣？,其他3個選項皆是
臺灣證券交易所臉書按讚總數大約多少?,多於3萬
依資本市場之效率性可將市場分為：,強式效率市場、半強式效率市場與弱式效率市場
「證券交易法施行細則」係由下列何機關所訂定？,行政院
證券交易所有違反法令之行為時，主管機關得為停止或禁止證券交易所全部或一部業務之處分，停止之期間依法為多長？,6個月
證券金融公司發生券源不足時所採行辦法之順序，是先公開標借，若不足時再洽特定人議價，仍不足時，最後才採行：,標購
下列何者為臺灣證券交易所「投資人知識網」的內容?,其他3個選項皆是
投資人需年滿幾歲才可開立信用帳戶？,18歲
下列哪一個官網的資訊宜涵蓋至永續資訊之管理的內部控制?,ESG專區
一般而言，股價波動性對理性投資人的意涵在於：,可以賺取價差
依「證券交易法」第一百五十七條之一利用內線消息買賣之民事責任的賠償額是？,消息未公開或公開後18小時內，其買（賣）價與公開後10個營業日收盤平均價之差額
證券商辦理委託人融資買進與融券賣出沖抵之交易，下列敘述何者錯誤？,資券相抵不必列入當日其融資融券限額內計算
下列關於「證券承銷」之敘述何者正確？,可有「包銷」或「代銷」兩種方式
何者為「證券分析」的目的？,尋找某些價格被高估或低估的資產
有關我國櫃檯買賣市場現行交易方式，下列何者正確？,採等殖成交系統交易債券
依「財團法人中華民國證券櫃檯買賣中心有價證券借貸辦法」規定，有價證券之出借費率，不超過該種有價證券等價成交系統最後一筆成交價格多少為限?,0.07
櫃檯買賣證券商應於開業前幾個營業日向證券櫃買中心申報？,五個
有價證券借貸之議借交易，其升降單位為：,0.1‰
"小王將1,000元存入銀行，若年利率為0.6%，每年付息一次，則2年後會變為：","1,012元"
已依證交法發行之公司得於一定條件下對特定人招募有價證券，稱之為何種行為？,私募
新藥研發公司申請創新板上市，其核心產品應通過哪一階段的臨床試驗？,第二階段
下列有關股份有限公司組織的敘述何者不正確？,一般而言，公司的所有權很難移轉給他人
下列有關證券商受託買賣外國有價證券應提供投資人資料之敘述，何者錯誤?,證券商得以資料或研究報告非本公司所核准發行為由，主張免除其責任
下列何者為金融科技相關的風險與監理之面向？,其他3個選項皆是
自112年7月31日起，期貨ETF之最近十個營業日，平均單位淨資產價值較其最初單位淨資產價值累積跌幅達多少比例以上時，投資人僅得賣出不得買進？,0.85
依發行人募集與發行有價證券處理準則之規定，發行人自金管會及金管會指定之機構收到申報書件即日起至申報生效前，除依法令發布之資訊外，下列何項敘述為不正確？,可先向投資人推薦股票
股票承銷公開抽籤之電腦作業，由哪一機構負責？,臺灣證券交易所
公司對員工依「公司法」規定優先認購之股份，得限制不得轉讓之期限最長為：,2年
甲公司的本益比為12倍，權益報酬率為13%（假設期初權益帳面金額等於期末權益帳面金額），則市價淨值比為何？,1.56
