題目,答案
請問在技術分析K線指的上影線最上端之股價價格為：,最高價
證券商經營期貨交易輔助業務者，於從事業務對客戶所生之損害，與委任期貨商負何責任？,連帶賠償責任
投資人申請查詢於各證券商開戶明細或證券交易資料，可查詢資料範圍包括：,其他3個選項皆是
在上升趨勢中，K線圖上出現高價跳空型態（High-price Gapping Play），即向上跳空缺口的陽線，表示行情可能：,繼續上漲
對非特定人為公開收購公開發行公司之有價證券者，應經何機關申報？,金融監督管理委員會
櫃檯買賣證券經紀商因執行受託買賣發生錯誤，須為買回、轉賣者，應如何處理?,於發生錯誤當日或次一營業日以錯帳處理專戶為之
下列何者為資本支出？,購入土地支付代書費
普通股股票須上市滿多久才可由證券交易所公告得為融資融券交易股票？,6個月
Z銀行為一家上市公司，甲、乙、丙3人因金融專業能力卓越在業界頗有聲譽而獲邀被選任為Z銀行的獨立董事，並由其3人組成審計委員會。下列敘述何者正確？,若審計委員會就內部控制制度有效性之考核事項為決議時，應有審計委員會全體成員二分之一以上之同意，始為有效之決議
權證流動量提供者之券商於下列何種時機仍需報價？,標的證券股價波動過大
下列哪種產業較不屬於利率敏感產業？,食品業
一般公司經常性的法律顧問費用是：,管理費用
下列何者非為創新板上市公司股票之處置方式？,分盤交易
下列何者「非」機構投資人進行盡職治理行為之資產類別?,其他3個選項皆是
何者不屬於衍生性金融工具？,公司債
6月8日投資人甲信用帳上有融資A、B、C股票，個筆擔保維持率分別為125%、128%、132%，整戶擔保維持率為128%，當日證券商郵寄發出A及B之追繳通知，假設次日送達，每日皆是營業日，6月10日期限到時，客戶未補繳，但是整戶擔保維持率提升至132%，請問6月11日早上應處分之股票？,不應處分
有關盤後定價交易之時間，下列何者正確？,14:00～14:30
在間接法下折舊是加在稅前淨利上，以計算來自何種活動之現金流量？,營業
無風險資產的貝它（Beta）係數為：,0
證券商相互間所生爭議應採仲裁程序，則下列選定仲裁人之程序何者正確？,當事人事先以書面約定
衡量資產運用效率的指標為：,銷貨收入÷營運資金
盤中零股交易預計於113年12月2日縮短撮合間隔時間至幾秒鐘?,5秒鐘
下列有關仲裁判斷之敘述何者錯誤？,法院確定判決的效力優先於仲裁判斷書之效力
客戶請求將其帳戶之有價證券餘額轉帳至設於他參加人帳戶時，應向哪一機構提出申請？,參加人
證券集中交易市場撮合成交時，買賣申報之優先順序原則為：,較高買進申報優先於較低買進申報
櫃檯買賣證券經紀商接受客戶以電話委託者，應同步錄音，對無爭議之電話錄音應至少保存多久期限？,一年
道氏理論雖然對股市長期市場變動指明了方向，但不能指示下列何者？,應購買何種股票
下列何者不是普通股的特性？,有優先清償權
小張想買權證，他問營業員權證可連結之標的有哪些，結果營業員說錯了哪項？,興櫃公司股票
依「證券交易法」之規定，得請求懲罰性民事賠償的是：,內線交易行為
竭盡缺口（Exhaustion Gap）通常出現在一波行情（無論上漲或下跌）的：,尾聲
公開發行公司之財務報告應經特定人士簽名或蓋章並出具財務報告內容無虛偽或隱匿之聲明，以下何人不是此指之特定人士？,監察人
經評估客戶單日買賣額度達新台幣多少元以上者，證券商應請其出具或提示相關資力證明文件憑核，並留存影本或抄錄相關資料備查？,500萬元
採集合競價期間，可用何種方式下單?,限價且當日有效
目前可上傳之Ixbrl檔案格式為何,HTML
甲公司將出售長期投資之收入記為營業收入，為：,盈餘操縱
下列何者為效率市場的定義？,市場能夠迅速正確反應所有攸關資訊，所有投資者將無法利用任何資訊賺取超額的報酬
有關系統開發及維護之規定，下列敘述何者正確？,應使用具有合法版權之軟體
可用於支付利息之盈餘係指企業之：,稅前淨利加利息費用
有關賣出股票所需繳交之證券交易稅敘述，以下何者正確？,賣出時以賣價計算
下列關於V形反轉（V Reversal）的敘述何者不正確？,趨勢的變動是緩慢而漸進的
在何處查詢投資理財節目異常推介個股？,臺灣證券交易所網站首頁>市場公告>投資理財節目異常推介個股
下列何者係影響財務報告品質的因素？　甲、管理階層對於會計方法之選擇　乙、會計的各種規範　丙、審計人員的教育程度　丁、會計估計發生之誤差,甲、乙、丁
於集中交易市場買賣在我國上市之外國股票使用之貨幣，以何者為準？,外國發行人向證交所申請上市之幣別
小張問一般投資人買賣權證與買賣股票之不同處，下列哪項是錯誤的？,另行開立不同帳戶
某公司債券已在櫃檯買賣，如其再發行債券時，應於開始櫃檯買賣日之前幾個營業日內，檢具櫃檯買賣申報書及有關書件，向證券櫃買中心申報？,五個營業日
得為融資融券交易之上櫃股票，其股價波動過度劇烈者，證券櫃檯買賣中心得為如何之處置？,其他3個選項皆是
投資人曾因證券交易違約，未結案者，須滿幾年始得再行開戶買賣？,5年
證券商為自行辦理有價證券買賣融資融券業務，何者為非？,須與證金公司簽訂融資融券之代理契約
現金流量為固定支出之倍數的計算公式為何？,（營業活動現金流量+所得稅支付數+利息支付數）÷固定支出
證券金融事業違背對證券集中交易市場之交割義務時，如何處理？,由證交所專案報請金融監督管理委員會處理
發行公司為變更公司名稱召開股東臨時會，已融券者應於幾個營業日內進行回補?,不須還券回補
一般所稱的債券殖利率是指下列何者？,到期收益率
財務彈性是指：,企業運用其財務資源以因應環境變動的能力
一般而言，投資人在選擇投資計畫時：,報酬率最低的計畫通常風險程度最低
以下哪一項沒有美化盈餘的效果？,應收帳款讓售（Factoring）
依「證券交易法」規定，受罰金以上刑之宣告者，其執行完畢、緩刑期滿或赦免未滿幾年者，不得充任證券商之董事、監察人或經理人？,3年
所得稅費用應列為：,本期稅前淨利之減項
下列有關「技術分析」的敘述中，何者為錯誤？,如果股價報酬率為「隨機漫步」，使用技術分析才有意義
內線交易情節重大者，法院得依善意從事相反買賣之人之請求，將內線交易賠償額提高以茲懲罰，所謂「善意」意指？,不知內部重大影響股票價格之消息者
一般而言，風險愛好者所投資之投資組合，其貝它（Beta）係數為：,大於1
公開發行公司停止辦理股票過戶之時點為何？,其他3個選項皆是
有關「公開收購」，下列敘述何者正確?,收購之有價證券限於公開發行公司所發行之有價證券
比較下列上市與上櫃股權分散之審查條件，何者敘述正確？,"上市上櫃皆有股權分散要求，前者係記名股東在1,000人以上"
下列何者非為證券交易法所稱之有價證券?,商業本票
下列何者較不受中央銀行公開市場操作的影響？,貨幣流通速度
貨幣供給中，M2與M1的組成成份差異為以下何者為是？,定期存款
當公司舉債過多時，公司營運會面臨較大的風險，以致投資報酬產生不確定性，此類風險稱之為：,財務風險
有關不動產、廠房及設備使用期間支出之處理，下列敘述何者正確？,其他3個選項皆正確
何者為會計師對公開發行公司年度財務報告之查核意見，無須載明其理由？,無保留意見
下列何者較不適合作為分析經營效率的指標？,銷貨毛利率
證券商財務報告之電子書可於下列哪個網站查詢及下載？,公開資訊觀測站
就上市公司對子公司內部控制之監督與管理，下列敘述何者錯誤？,上市公司稽核人員得兼任其子公司稽核人員
某營業員接到客戶鉅額買進委託，要以參考基準價格下兩檔買進某電子股500張，若參考基準價格為50元，請問營業員應填寫之委託報價為：,49.98元
投資人從報紙看到政府將進行重大公共政策，因此大量買進營建類股，這種行為？,不違法
下列何項作法可增加流動比率(假設目前為1.3)？,以發行長期負債所得金額償還短期負債
國內現行當日沖銷交易之股票課徵稅率為?,1.5‰
不限用途款項借貸有關擔保品融通之計算標準，何者為錯？,地方政府公債，按其面額40% 計算
"若漢本公司的速動資產為10,000，流動負債為20,000，現有一筆交易使存貨及應付帳款各增加$5,000，則其速動比率應為何？",0.4
申請股票上市之投資控股公司，應符合下列哪些要件？,其他3個選項皆是
證券集中保管事業保管有價證券之方式為何？,混合寄託之保管
設某上櫃股票之每股市價為三十元，其申報買賣之最低成交單位為何？,五分
在K線型態中，長黑之後收十字線的孕育十字線（Harami Cross）可視為：,底部訊號
證券商相互間有價證券交易之爭議，一造當事人未依法進行仲裁而提起訴訟時，應如何處理？,法院應依他造之請求駁回其訴
證券商的營業櫃台下列何人不得進出？,客戶
上市公司總經理知悉公司的重大利多消息，等消息一公開，就馬上買入自家公司股票。這種行為？,涉及內線交易
財務報表係假設公司繼續經營，故應按何基礎入帳？,取得成本
下列何者為鉅額逐筆交易之交易時段？,9:00~17:00
有關證券交易爭議之仲裁，下列敘述何者正確？,其他3個選項皆正確
試問公開發行公司除經主管機關核准者外，董事間應有如何比例之席次，不得具配偶或二等親以內之親屬關係？,超過二分之一
證券承銷商辦理有價證券之承銷，現行有幾種配售方式？,四種
在波浪理論中，漲升波與修正波分別有幾個？,5、3
池上公司宣告股票股利，宣告前之流動比率為2，則宣告後：,保留盈餘減少
股市名嘴在社群媒體上推薦分析特定個股利多消息，建議會員買進，以下何者正確?,若散布不實消息或意圖影響市場，可能被移送司法單位偵辦
我國資本額達新臺幣100億元之上市上櫃公司之合併財務報告子公司，應自何時起完成溫室氣體盤查之確信資訊揭露？,2027年
已知富源公司X7年度速動比率0.8，流動比率1，則該公司企業血壓為：,0.2
下列有關庫藏股的敘述，何者正確？,庫藏股會影響公司的每股盈餘
股份有限公司設立時，第一次發行股份總數，至少應達全部股份總數之多少比例？,無限制規定
動能投資策略其假設投資人可以因為市場反應不足而獲得超額報酬，其策略類似於：,追漲殺跌
有關資訊安全之機密性，下列敘述何者正確 ？,需要經過授權後，始可取得相關資訊
證券商依規定必須每月幾日以前申報資本適足比率資料？,十日
為防制內線交易，下列何者「不」是臺灣證券交易所所做的努力?,舉辦員工運動會
有關「公司法」之公司，下列敘述何者正確？,公司以其本公司所在地為住所
具備下列何項資格可為推薦股票上櫃之證券商？,具證券承銷商及櫃檯買賣自營商資格
下列何項在資產負債表中屬於「現金及約當現金」之一部分？,一年期定期存單
投資資訊中心提供之下載資料檔案格式不包含下列何者,WORD
有關證券經紀商手續費敘述，以下何者正確？,買進與賣出時各計算一次
仲裁庭認定仲裁達於可為判斷之程度者，依當事人聲明之事項，應於幾日內作成判斷書？,10日
何者為投資本國政府債券所會面臨的主要風險？,利率風險
甲上市公司董事長王先生利用職權掏空公司資產的行為，何者正確？,掏空公司資產是經濟犯罪的一種，非屬內線交易
證券金融事業辦理對證券商之轉融通，指：,證券商向證券金融事業辦理轉融通資金或有價證券
何者不是持有某公司債券的系統風險?,發行公司的財務風險
對從事有價證券之承銷、自行買賣及經紀業務之自律規則，係由下列何者單位負責擬定？,證券商業同業公會
稱轉融通者，指下列何者向證券金融事業辦理轉融通資金或有價證券？,證券商
依法規定下列何者應列席董事會報告稽核業務?,稽核主管
股份有限公司董事之報酬，未經章程訂明者，得以何種方式議定？,由股東會議定
關於委託人融資融券擔保維持率，下列哪一項敘述正確？,融資擔保品證券市值下跌，會使擔保維持率下降
下列何者為綜合證券商業務經營範圍？,承銷、自營、經紀業務
股份有限公司之股東常會，每年至少應召集幾次？,1次
證券商經營櫃檯買賣，下列敘述何者正確？,兼具證券自營商及經紀商者，於每次買賣時之書面文件區別自行或代客買賣
其他條件相同，在通貨膨脹期間，投資人可接受的本益比：,較低
下列何者不是衡量風險的指標？,平均數
何謂「風險規避者」？,即財富的邊際效用大於0，而邊際效用隨著財富的增加而遞減
下列何者不是股份有限公司之解散事由？,公司轉投資逾越公司章程之規定
下列何種情形，上市(櫃)公司毋須委請承銷商出具評估報告？,補辦公開發行
應付公司債折價於資產負債表中應列為：,負債之減項
證券金融公司某種證券有價證券發生差額時，應於何時起向該種證券所有人標借？,次一營業日9:00
存貨週轉率愈高，則：,有過時存貨的機會愈小
某公司今年度每股盈餘5元，表示其可發放之每股股利為：,不一定
為鼓勵企業支持文化藝術活動並促進文化永續發展，上市上櫃公司宜經由的支持模式，何者為非?,用愛發聲
高登主廚的「是chef」餐飲集團目前為第一上櫃公司，近日高登主廚考慮要申請第一上市，請問下列何者非為第一上櫃轉第一上市之相關規定?,證交所還是必須召開審議會審核其第一上市申請
證券承銷商出售證券時，負有代理發行人交付何種文書之義務？,公開說明書
以下敘述何者正確？,股份有限公司之董事與公司之為委任關係，故董事應負之責任，除善良管理人之注意義務，尚有忠實義務
在何網站查詢公布處置股票資訊？,臺灣證券交易所網站首頁>市場公告>公布處置股票
投資人想要找上市公司除權息行事曆，需要到投資資訊中心的哪一個頁面,市場公告與服務
證券經紀商與證券交易所因使用市場契約所生爭議，得以下列何方式處理？,應強制仲裁
下列何者會影響盈餘品質？,其他3個選項皆會會影響
電話委託買賣股票時，可透過何種管道委託買賣？,證券公司電話
申請以科技事業上市之發行公司，應經何者出具其係屬科技事業之明確意見書？,該事業之中央目的事業主管機關
下列何項不可能會出現在企業的綜合損益表？,保留盈餘
下列有關短線交易規定之敘述，何者錯誤？,短線交易的期間為三個月
當日現券賣出成交後，未完成反向買進，致無法完成當日沖銷交易時，投資人可透過哪一種方式完成交割?,其他3個選項皆是。
依「發行人證券商證券交易所會計主管資格條件及專業進修辦法」規定，證券商會計主管每年應參加經主管機關認定之進修機構所舉辦之會計、審計、財務、金融法令、公司治理、職業道德及法律責任等相關專業訓練課程幾小時以上？,12小時
以下哪項資訊無法在ESG數位平台取得？,財報
自行利用技術分析，買賣股票獲利，這種行為？,不違法
公司制證交所之董事、監察人至少應有多少是由主管機關指派非股東之有關專家任之？,三分之一
下列何者最不可能是兩檔股票報酬率之間的相關係數(coefficient of correlation)？,1.27
證券商委託人月成交金額達5千萬元以上者，除專業機構投資人與透過保管機構進行款券保管、交易確認及辦理交割者外，應抽查多少樣本數，並以掛號向委託人戶籍地詢證?<,至少20%或20戶
集中交易市場之買賣，採何種方式？,電腦自動交易
臺灣各類型ETF每日的漲跌幅度限制何者為是？,現行2倍槓桿型台股ETF之漲跌幅度限制為±20%
"X9年基隆綜合損益表列報之利息費用40,000，所得稅費用60,000，淨利240,000，同年之資產負債表顯示總資產2,400,000，流動負債300,000，非流動負債為900,000，則財務槓桿指數為何?<",1.77
下列敘述何者正確？,發起人之股份非於公司設立登記後，不得轉讓
證券金融事業依標借、議借程序所取得證券之數量仍有不足時，應於當日之何時委託證券商在證交所辦理標購？,14:30前
內線交易情節重大者，法院得將損害賠償義務人之賠償額提高三倍，其前提要件為何？,須有損害賠償請求權人之請求
目前證券金融事業得經營下列哪些業務？,其他3個選項皆是
下列何者「非」為公司治理評鑑辦理目的?,引起企業互相檢舉
何者現象發生時，政府將會採取寬鬆的貨幣政策？,綠燈轉為黃藍燈
衡量風險時，需考慮到多方面的風險來源，如石油危機、美中貿易戰即屬於：,市場風險
關山公司應收帳款收現時，則（考慮立即影響）：,現金對固定支出的保障比率上升
未上市公司持股一千股以上之記名股東人數未達三百人者，於現金發行新股時，原則上應提撥發行新股總額之多少比率，對外公開發行？,百分之十
對獲利不佳的資產股而言，下列何種評價方法較適當？,每股股價除以每股重估淨值
大同發現市場上有許多以台積電為標的的認購權證，如果在其他情況相同條件下，距到期日越長，認購權證的價格為何?,越高
是否每一家證券商都可以辦理ETF的申購/贖回？,否，必須符合證交所規定之資格並與ETF發行人簽約的參與證券商才可辦理
下列何者不是權益證券（Equity Securities）？,公司債
下列何者並非證券商得經營之業務？,提供集中交易之場所及設備
於編製合併報表時，需將子公司沖銷後之普通股股東權益餘額轉列：,非控制權益
某公司今年每股發放股利3元，在股利零成長的假設下，已知投資人的必要報酬率為6%，則每股普通股的預期價值為：,50元
會員制證券交易所董事、監事之任期規定為何？,均為3年，連選得連任
保護基金投資每家上市上櫃公司股票之原始投資不得超過：,一千股
下列何者為股份有限公司章程絕對必要記載事項？,董事及監察人之人數及任期
下列何者非為證券交易法所稱之有價證券?<,商業本票
甲公司董事長乙未經證券主管機關核准，亦未申報，即自行公開招募所發行之有價證券，請問，乙之行為應負何法律責任？,可處五年以下有期徒刑
依「公司法」規定，下列何者非股份有限公司的負責人？,公司股東
證券交易爭議當事人間對仲裁程序事項，下列敘述何者有誤？,當事人未約定仲裁地者，由法院決定
何者不是持有某公司債券的系統風險?<,發行公司的財務風險
初次申請股票上市之發行公司，所應提交集中保管股票之總計比率，在已發行股份總額三千萬股以下者，應提交股份總額百分之多少？,0.25
委託人申請開立信用帳戶訂定融資融券契約，除期滿辦理續約者外，應開立受託買賣帳戶滿幾個月才可申請開立信用帳戶？,3個月
以下哪些組合符合公開發行公司審計委員會行使職權辦法所設置之審計委員會?<,由分別具生醫、法律、會計專業背景全體獨立董事共4位組成之審計委員會
公開發行公司公司之董事、監察人、經理人，其股票之轉讓，應依一定方式進行，下列方式，何者正確？,於向主管機關申報之日起三日內，向符合主管機關所定條件之特定人為之
櫃檯買賣股票之報價單位與成交單位分別為幾股：,"1股；1,000股"
委託人融資期限屆滿未清償，經證券商處分擔保品後，自逾期之日起，至清償日止，按核定利率之多少比率加收融資違約金？,0.1
證券商以現金繳存給付結算基金者，其所生孳息，證券櫃買中心係依下列何種方式處理？,每半年結算乙次，於扣除其稅捐及所需費用後發還
權證距到期日幾個交易日以內，流動量提供者提供報價，得僅申報買進?<,15個
下列何種資產減損損失不得迴轉？,商譽
"新馬公司開出60天期票據，向銀行借入現金$100,000，則：",營運資金不變
證券經紀商接受客戶委託進行櫃檯有價證券之買賣時，證券櫃檯買賣中心對於委託單有何限制？,每筆輸入股數不可超過50萬股
仲裁事件依法於仲裁判斷前得為和解，若當事人間和解成立者，由何者作成和解書？,仲裁人
防制內線交易之目的「不」包括？,防範公司資產遭掏空
一般而言，景氣由谷底復甦時，舉債程度較高的公司股票：,價格漲幅較大
金管會發布之「上市櫃公司永續發展路徑圖」，目的在推動上市櫃公司?,進行碳盤查及查證
除有特別規定外，證券商所持有之營業用不動產及設備總額，及非營業用不動產總額合計不得超過其資產總額之多少比例？,0.6
證券商之董事、監察人及經理人發生不得擔任董事、監察人與經理人之消極資格情事時：,該券商應於知悉或事實發生之日起5個營業日內申報
「證券交易法施行細則」係由下列何機關所訂定？,金融監督管理委員會
本國發行人要申請為興櫃股票，不須達成下列何項條件？,有3家證券商書面推薦
證券商如發現疑似洗錢或資恐交易者，應於專責主管核定後立即向那個單位申報?,法務部調查局
辦理法人說明會效益可為上市公司帶來那些效益?,其他3個選項皆是
證券商辦理有價證券買賣融資融券，對每種證券之融資總金額，不得超過其淨值的多少比例？,0.1
證券投資人如遭遇投資民事糾紛，可向證券投資人與期貨交易人保護中心所設立之調處委員會申請調處，委員會應於受理申請幾日內進行調處？,15日
「證券商營業處所買賣有價證券管理辦法」第二條對櫃檯買賣的定義是：,不在集中交易市場以競價買賣，而在證券商專設櫃檯交易
證券主管機關於何種情形之下，得命令證券商提出財務或業務之報告資料，或檢查其營業、財產、帳簿等物件？,其他3個選項皆可
就技術分析而言，支撐水準（Support Level）的位置，通常表示：,買氣大於賣壓
上市公司董事參加董事會知悉重大利多消息，在此消息正式對外公開幾小時之後始能買賣該公司股票？,18小時
證券商製播廣告，應由證券商業同業公會訂定辦法，並：,不得誇大或偏頗
有關短線交易利益歸入權，下列敘述何者正確？,董事或監察人不行使請求權，致公司受有損害時，對公司負連帶賠償之責
甲公司之股票雖在證券櫃買中心掛牌，但是嗣後公告並申報之最近期財務報告顯示淨值為負數，證券櫃買中心應如何處理？,得終止甲公司有價證券櫃檯買賣，並報請主管機關備查
會員制證券交易所，經主管機關許可並依法辦理登記後，應向國庫繳存營業保證金，其金額為下列何者﹖,會員出資總額百分之五
台積電普通股股票除可以本國編碼2330表達外，亦可以其他國際通行的編碼方式表達。若將台積電普通股表達為「TW0002330008」，請問是根據以下何種編碼方式進行表達?,ISIN (International Securities Identification Number)
重整監督人應決定之事項下列何者為非？,重整期間界定
下列何者人員得擔任防制洗錢專責主管？,法令遵循主管
以下有關「共同責任制交割結算基金」敘述，何者為非？,本基金由所有上市櫃公司繳存
資本額達新臺幣100億元以上之上市上櫃公司（含合併財務報告子公司），最晚須在何時揭露溫室氣體盤查之減碳目標？,2025年
各種得為融資之股票，證券金融公司均於除權交易日前幾個營業日起，按每天收盤價格扣除其權值，如整戶維持率不足，即辦理追繳差額？,六個營業日
彰化公司未調整應收票據所產生之應收利息，將：,低估利息收入
