題目,答案
依我國證券交易法規定選任獨立董事公開發行股份有限公司，有重大之資產或衍生性商品交易事項於提董事會討論時，如獨立董事有反對意見或保留意見，請問應如何處理？,應於董事會議事錄記載
下列何種標的不可進行定期定額投資?,其他3個選項皆是
證券商受託買賣何種有價證券，應向非專業投資之客戶交付「風險預告書」？,外國有價證券
下列何者為臺灣證券交易所「宅在家學習網」所提供的內容包括有?,其他3個選項皆是
有價證券借貸之交易型態不包括下列何者?,等價交易
下列何者不符合證券商僱用業務人員應具備之條件？,曾犯詐欺罪，受有期徒刑宣告，但已執行完畢滿一年者
何者不屬於道氏理論中之波動？,移動平均波動
不動產、廠房及設備之取得成本應包括購價，並：,扣除現金折扣
除經主管機關核准者外，公開發行公司應於會計年度第二季終了後幾日內，公告並申報由董事長、經理人及會計主管簽名或蓋章，並經會計師核閱及提報董事會之財務報告？,45日
在大陸地區設立登記的公司是否可以直接申請來臺第一上市?,不可以；宜透過其海外控股公司為上市主體申請來臺上市
證券承銷商代銷有價證券，於承銷契約所訂之承銷期間屆滿後，對於約定代銷之有價證券，未能全數銷售者，其剩餘數額之有價證券如何處理？,得退還發行人
現金流量比率等於：,營業活動淨現金流量／流動負債
下列有關證券爭議之仲裁判斷效力之敘述何者正確？,與法院之確定判決，有同一效力
某股市作手與財經節目分析師共謀，於節目中散布特定個股之不實消息意圖影響市場，可能涉及何種違法行為？,操縱股價。
外國企業公司欲申請來臺灣第一上市，需於上市時向臺灣證券交易所繳納多少上市審查費?,50萬元
對有價證券之行情與認募重要事項為虛偽之記載而散布於眾者，最重可處多少年以下之有期徒刑？,7年
關於發行申報、公告之財務報告內容有虛偽或隱匿情事時之民事賠償責任，其賠償對象為下列何者？,限於因而受有損害之善意取得人、出賣人或持有人
待分配股票股利在資產負債表上，應列於：,權益
公司之股東名簿，自然人應使用國民身分證記載之姓名為戶名，對於同一股東之戶號：,僅能開列一個戶號
依「證券交易法」所定刑事責任，有期徒刑最重為幾年？,10年
下列何項不屬於財務報表的「要素」（Element）？,來自營業活動的現金流量
上市或上櫃公司應於每月十日申報並公告之上月份營運情形，不包括下列何者？,資產淨額
ETF架構為開放型基金，是否會跟一般基金一樣，調整投資組合內容？,會，隨著其標的指數成分股的調整而調整
未完成反向買進之當日沖銷交易部位，投資人透過應付當日沖銷券差平台借入證券之借券每日費率最高為何?,0.07
假設台積電今天收盤股價為320元，請問下一個營業日漲停板價格為何？,352元
請問證券商申報投資人違約相關資訊，可以在以下哪個網站找到？,證交所官網-違約公告專區
編製合併報表時，母公司持有子公司發行之特別股視為：,收回特別股
上市公司有何種情事，證交所應依「證券交易法」停止該公司上市之有價證券買賣，並報請主管機關備查？,其他3個選項皆是
流動資產增加，公司企業血壓：,有可能上升或不變
在股利折現模型（Dividend Discount Model）裡，下列何者不會影響折現率？,資產報酬率
投資ETN的風險為何？,其他3個選項皆是
下列選項為以文化創意事業身分申請股票上市之發行公司資料，請問哪一項不符合申請條件？,申請上市時之實收資本額為新台幣兩億元
創新板股票上市首五日的漲跌幅限制為何？,無漲跌幅
依現行「證券交易法」規定，公開發行公司設置審計委員會者，未經審計委員會通過之事項，何者不得由全體董事以三分之二以上同意取而代之？,年度財務報告及須經會計師查核簽證之第二季財務報告
鉅額交易最低數額標準?,其他3個選項皆是
相同經濟事實的兩公司同一年的折舊方式皆採用年數合計法，係強化哪項品質特性？,可比性
有關借入有價證券的運用，下列哪一個正確？,有用途上之限制
下列有關我國資產重估規定之敘述，何者正確？,符合條件者不一定須辦理重估
有價證券得為融資融券標準係由下列哪一機構訂定發布？,金融監督管理委員會
臺幣對美元貶值所造成的影響，以下何者不正確？,貨幣供給增加
「證券交易法」所謂發行，係指發行人於募集後，依法定方式所為之何種行為？,製作並交付有價證券
頂埔公司以其全部應收帳款為質押向銀行融資借款，此事件對該公司的影響為：,速動資產增加
關於證券商辦理內部稽核業務之人員，下列何項敘述錯誤？,證券商應於異動後5日內，向臺灣證券交易所等申報登記
公司在預定買回期間，執行買回本公司股份所預定之最高及最低之買回價格，稱為：,買回區間價格
上市公司的客戶，因為職務之便實際知悉公司即將調降財測，而在市場周知之前賣出股票，如此可能構成以下何種行為？,內線交易
依「櫃買中心外幣計價國際債券管理規則」，下列哪種外幣計價之證券為國際債券?,其他3個選項皆是
買賣臺灣存託憑證之證券交易稅率為：,1‰
公司宣布並發放股票股利：,權益比率不變
下列有關保留盈餘指撥之敘述，何者正確？,保留盈餘的指撥，將使權益總額不變
下列何者不具有交割結算基金優先受償之權利？,證券金融公司
企業進行轉投資，執行購入長期股票的控股策略，請問就現金流量表之分析，這項交易應屬下列何種活動？,投資活動
下列何者非證券集中交易市場之結算標的？,台股期貨
安全邊際係指：,銷貨收入－損益兩平銷貨收入
融券之證券，每一交易單位之市場價格，超過規定融券限額時，委託人信用帳戶內如無融券餘額，得融券幾個交易單位？,一交易單位
「公司法」規定，以募集設立方式公開招募股份時，發起人所認股份不得少於第一次發行股份之若干？,四分之一
證券集中交易市場上市之有價證券，何者得為帳簿劃撥？,其他3個選項皆是
老王過去使用濾嘴法則進行投資決策，常使他賺取豐厚的利潤，其所處市場應屬哪一效率市場假說？,其他3個選項皆非
證券商出借有價證券予客戶，應與客戶議定出借費率，此費率上限何者正確？,年利率16％
下列那些科目屬於「非」常續性？　甲、營業收入；乙、停業單位損益；丙、會計政策變動追溯適用影響數；丁、營業費用,僅乙、丙
已設置審計委員會之公開發行公司，依法應經審計委員會決議之特定事項，應得全體委員多少比例之同意？,二分之一
以下哪些屬於自願設置之功能性委員會?,其他3個選項皆是
證券商辦理融資融券時，對客戶所留存融券賣出之價款或融券保證金，依法不得作下列何項之運用？,買賣公司債
下列有關永續報告書編製重點，何者正確？,避免過度艱澀的專有名詞
幾個常見的網路攻擊手法中，哪一個可以在沒有主機程序的情況下自我複製並傳播？,蠕蟲
股份有限公司依公司法規定申請停止公開發行時，應由代表已發行股份總數____以上之股東出席股東會，以出席股東表決權_____以上同意行之?(公司章程有較高規定從其規定),三分之二，二分之一
「證券交易法」對足以影響市場秩序行為之違約不履行交割的法定刑責為：,三年以上十年以下有期徒刑
股份有限公司發起人股份不得轉讓限制，於設立登記多久後才能解除？,無限制
金融控股公司發行普通公司債，並檢具對外公開發行公司債申報書與書件，向金融監督管理委員會提出申報，一般情形，金管會受理發行公司債申報書之日起幾個營業日即可申報生效？,10個
證券集中交易市場內有價證券之買賣分為哪三種？,普通交割之買賣、成交日交割之買賣、特約日交割之買賣
證券商委託人月成交金額達5千萬元以上者，除專業機構投資人與透過保管機構進行款券保管、交易確認及辦理交割者外，應抽查多少樣本數，並以掛號向委託人戶籍地詢證?,至少20%或20戶
基本分析所考量的因素，不包括：,成交量
證交所臉書的內容包括：,其他3個選項皆是
下列敘述何者錯誤？,有價證券之募集及發行，除政府債券或經主管機關核定之其他有價證券外，報請主管機關備查即可為之。
有關仲裁人之推定與選定，下列敘述何者有誤?,未約定仲裁人及選定方式者，應由兩造各推一仲裁人，共同仲裁
若參加證券櫃買中心債券等殖成交系統，應以哪種方式為之？,自營
利率上升所造成的影響，以下敘述何者不正確？,投資者的必要報酬率會下降
自113年11月11日起，下列何者其資格符合證券商辦理證券業務借貸款項，上市上櫃公司現金增資發行新股認股借貸的資金融通對象？,發行公司之原股東及員工
目前證券商營業處所受託買賣有價證券的交易手續費上限為多少？,1.5‰
證券交易所之設立，未於登記前先經主管機關之特許或許可，處多少罰金？,新臺幣一百八十萬元以下
證券交易所備供證券買賣一方不履行交付義務時之代為支付，而就其證券交易經手費提存之準備金稱之為：,賠償準備金
下列有關公司債之敘述何者「正確」?,可轉換公司債賦予投資人可轉換一定數量的普通股股數
上市公司於臺灣證券交易所終止上市時，可向櫃買中心申請股票為何種股票？,管理股票
假設其他條件不變，外幣存款的規模逐漸擴大，將會使何者貨幣供給增加？,M2
當公司有以下哪一情事時，即使符合基本資格，證券櫃買中心仍認為其不適宜上櫃買賣？,其他3個選項皆是
有關投資人買賣ETN之敘述，下列何者為非？,ETN於上市時即可信用交易
集中交易市場存託憑證每日之升降幅度為：,0.1
弱式效率市場表示無法以哪一項資料獲得超額報酬？,技術分析
有關公司治理主管之進修時數？,每年應至少進修18小時
在K線型態中，長紅之後收十字線的孕育十字線（Harami Cross）可視為：,頭部訊號
下列何者屬於無形資產？,商標權
何者「不是」影響資本市場線（CML）的斜率的因素？,投資組合報酬率標準差
普通股每股損失$2，分配20%股票股利將使每股損失：,減少
客戶何種委託買賣方式，證券經紀商不得受理？,其他3個選項皆不得受理
債券價格上漲的原因可能為：,市場資金大幅寬鬆
發行新股上市買賣之公司，應於新股上市後幾日內，將有關文件送達臺灣證券交易所？,10日內
現行股票「一般交易」的成交時間為何時？,09:00~13:30
融券人欲標的證券公司有下列哪種情況不用強制回補？,臨時股東會
私人間直接讓受上市有價證券，其數量不得超過一個成交單位，且前後兩次之讓受行為相隔不少於多少期間？,3個月
下列何者為被動式操作管理之基金?,其他3個選項皆是
雙溪公司的財務槓桿度為1.3倍，營運槓桿度為2.8倍，則公司綜合槓桿度為：,3.64
發行5年期，2年內可轉換為普通股之公司債，在資產負債表中應列為：,長期負債
證券商經營櫃檯買賣業務，依法應向證券櫃檯買賣中心繳存下列何項費用方得經營？,給付結算基金
在半強式效率市場中，股價會因為何種因素而超漲？,公司內部人的拉抬
殖利率小於票面利率的債券稱為：,溢價債券
下列何者非為「證券交易法」規定之證券業務種類？,有價證券之保管
若依我國企業實務慣用分類方式編製現金流量表，下列何者屬於因營業活動而產生之現金流量？,收到存貨保險賠償款
當股價持續上漲，而OBV線卻下滑時，代表：　甲.價量背離；乙.買進訊號；丙.價漲量增；丁.賣出訊號,甲、丁
對債權人而言，公司下列何項決策讓債權人認為相對有利？,發放股票股利
證券經紀商依規定預收客戶買進之價金時，應透過何者為之？,交割專戶
下列何種上市有價證券之交易可不在證券集中交易市場為之？,其他3個選項皆是
依「證券交易法」規定，從事內線交易者應負何種法律責任？,刑事責任及民事責任
下列何種人非「證券交易法」第一百五十七條之一禁止利用未公開重大影響股票價格之消息所列之「內部人」？,透過媒體報導知悉公司虧損遂賣出持股一萬股之股東
"某上市公司之股票發行量為1,000萬股，股價60元，本益比為15倍，該公司年度盈餘等於：","40,000,000元"
下列何者不是導致ETN終止上市的因素？,發行人拒絕投資人的申購申請
證券商會計主管之任免，應經何人同意？,董事會以董事過半數出席，及出席董事過半數同意之決議
下列哪個因素會使證券市場線（SML）的斜率變緩？,Rm變小
ETF可否進行零股交易？,可以
委託人委託證券經紀商買賣有價證券之委託方式為：,其他3個選項皆是
得為融資融券之受益憑證，有下列哪一種情形時，已融資融券者，應於終止上市前第一個營業日前償還或還券了結？,受益憑證經買回致其基金規模達終止上市標準時
證券集中交易市場上市證券拍賣程序，委託申請拍賣者，應由何者填具申請書向證交所辦理？,僅證券經紀商
股票未在國外證券市場掛牌交易，且其股票經臺灣證券交易所股份有限公司同意上市之外國發行人稱之為：,第一上市公司
投資資訊中心可以顯示多久的交易資訊,30個交易日
「證券交易法」所謂「利用他人名義持有股票」，有關具備之要件下列何者錯誤？,受贈他人所持有之股票
長期營業用資產須於何時作資產減損之測試？,客觀證據顯示資產價值有減損可能時
"甲公司所生產的礦泉水每瓶售價$35，其中變動成本佔60%，已知目前每年產量為40,000瓶，該公司剛好損益兩平，請問其固定成本約為多少？",400000
決定一財務報表資訊是否具有「重大性」的標準，通常是看該項資訊是否：,影響一般投資人的專業判斷
下列哪一項基金之風險最高？,產業型基金
下列何者非為動態分析？,流動比率分析
在計算現金再投資比率時，分母包括：　甲、不動產、廠房及設備總額；乙、長期投資；丙、現金股利；丁、營運資金,甲、乙、丁
證券經紀商受託買賣有價證券，關於電子式交易部分應依下列何項規定辦理？,其他3個選項皆是
以下哪一個會計科目，不應在綜合損益表之營業費用項中出現？,匯兌損失
已知曉臣公司股價每股56，每股股利2，每股帳面金額46，每股盈餘7，請問曉臣公司的本益比為？,8倍
「證券交易法」第一百五十七條之一「內線交易」構成要件，指該消息明確後，未公開前或公開後多少小時內，不得買入或賣出？,18小時
投資人在單一公司頁面，可找到哪些資訊,其他3個選項皆是
證券商須經主管機關之許可及發給許可證照，方得營業，非證券商不得經營證券業務，故證券商之設立採何種制度？,許可制
證券商業務人員類別及其職務之配合，下列敘述何者有誤？,業務員從事內部稽核或主辦會計職務
不限用途款項借貸之擔保品範圍下列何者錯誤?,外幣買賣之指數股票型基金受益憑證
有關開戶作業規定，何者有誤？,因證券交易違背契約紀錄已結案但未滿五年者，不可以開戶
下列何者屬於國庫券的特性？,到期憑票兌領本息
若一食品公司兼營營建開發業務，則欲瞭解其食品業存貨週轉情況之計算，以下列何者為佳？,（營業成本－營建銷貨成本）／（存貨－營建存貨）
下列何種事業非為集中保管劃撥作業之參加人？,散戶投資人
土地辦理重估後，其對財務報表影響之敘述，何者不正確？,折舊增加
關於ETF的敘述，下列何者為非？,投資人可透過證券商以定期定額方式投資所有類型ETF
依證券商設置標準許可之證券商，擬申請設置分支機構者，至少自開始營業後屆滿多久時間方可申請？,一年
依「證券交易法」規定，證券主管機關認為有必要時，得以命令規定公開發行公司於分派盈餘時，應另提一定比率之何種公積？,特別盈餘公積
股份有限公司之發起人最少應有人數若干？,二人
甲公司董事長乙未經證券主管機關核准，亦未申報，即自行公開招募所發行之有價證券，請問，乙之行為應負何法律責任？,可處二年以下有期徒刑
以下何者為參加創新板初上市申購抽籤或競價拍賣承銷作業投資人須具備合格投資人身份之具體條件?,其他3個選項皆是
集中市場有價證券之交易，連續幾個營業日經發布注意交易資訊者，證交所即發布為處置之有價證券？,5個
下列何者為「貨幣市場」的工具?,可轉讓定期存單
股份有限公司欲委任專業經理人，原則上需有董事會過半數出席及出席董事多少比例同意？,二分之一
存貨週轉率係測試存貨轉換為下列哪項科目的速度？,銷貨成本
基本分析中的由上而下（Top-Down）分析法認為影響股價最重要的因素是：,總體因素
下列何種承銷方式較具公平性及股權分散？,公開申購配售
其他條件相同時，當殖利率改變時，到期日較短之債券，其價格變動幅度會：,較小
下列何者「不」是企業永續經營的內涵理念?,只在乎短期利益最大化
證券商對於監理人員本於法令之指示，未切實遵行者，則依「證券交易法」可處以法定最高有期徒刑為何？,1年
"桃園公司X1年度純益640,000，其他有關資料如下：折舊170,000，應付租金減少數30,000，出售長期股權投資損失80,000，銀行借款$1,018,000。則由營業活動產生之現金淨流入為何？",860000
